{
  "request_id": 4,
  "stub": true,
  "fixture_mode": "SYNTHETIC_DEMO",
  "artifact_status": "candidate_unapproved",
  "design_revision": "sha256:fac39ef03be1ba8edbaa30b7cdcfab02e58ca14db00ade4c3c212049b23171dc",
  "rule_pack_sha": "sha256:ac95bcdd0bdb967b90afab1b0fa8f3c8a6581220c96382207b3ba2f432c8f97f",
  "rule_pack_status": "unapproved_input",
  "destination_policy_sha": null,
  "ecfr_date": "2026-09-01",
  "determinations": {},
  "delta": {
    "changed_nodes": [],
    "tripwires_added": [],
    "tripwires_removed": [],
    "rules_evaluated": []
  },
  "summary": {"clear": 0, "watch": 0, "question": 0, "flag": 0}
}
