{
  "request_id": 1,
  "stub": true,
  "fixture_mode": "SYNTHETIC_DEMO",
  "artifact_status": "candidate_unapproved",
  "design_revision": "sha256:fac39ef03be1ba8edbaa30b7cdcfab02e58ca14db00ade4c3c212049b23171dc",
  "rule_pack_sha": "sha256:ac95bcdd0bdb967b90afab1b0fa8f3c8a6581220c96382207b3ba2f432c8f97f",
  "rule_pack_status": "unapproved_input",
  "destination_policy_sha": null,
  "ecfr_date": "2026-09-01",
  "determinations": {
    "kestrel": {
      "state": "flag",
      "jurisdiction": "EAR",
      "entries": ["9A012.a.1"],
      "direct_tripwires": [
        {
          "rule_id": "CCL-9A012.a.1",
          "state": "fired",
          "jurisdiction": "EAR",
          "entry": "9A012.a.1",
          "reason_for_control": ["AT1"],
          "node_id": "kestrel",
          "cause_node_id": "kestrel",
          "facts": [
            {"attribute": "bvlos", "observed": true, "unit": null, "operator": "equals", "threshold": true},
            {"attribute": "endurance_h", "observed": 2.5, "unit": "h", "operator": "<", "threshold": 3},
            {"attribute": "endurance_contract", "observed": "SYNTHETIC_DEMO_ONLY", "unit": null, "operator": "equals", "threshold": "SYNTHETIC_DEMO_ONLY"}
          ],
          "text": "[UNAPPROVED SHAPE VECTOR] a.1. A maximum 'endurance' less than 3 hours;",
          "source_url": "https://www.ecfr.gov/current/title-15/part-774",
          "ecfr_date": "2026-09-01",
          "rule_effective": "2026-08-13",
          "evidence": {"level": "synthetic", "sha256": "sha256:c60be9cd7da59aa8e5cca3bce8a3938bd40d79f7aec5f3a3fb4c7c40e818b51f", "span": [1837732, 1837784]}
        }
      ],
      "propagated_tripwires": [],
      "unresolved_tripwires": [],
      "destinations": {"status": "not_evaluated", "reason": "P0 has no approved destination policy"},
      "evidence_level": "synthetic"
    }
  },
  "delta": {
    "changed_nodes": ["kestrel"],
    "tripwires_added": [{"node_id": "kestrel", "rule_id": "CCL-9A012.a.1", "kind": "direct"}],
    "tripwires_removed": [],
    "rules_evaluated": ["CCL-9A012.a.1"]
  },
  "summary": {"clear": 0, "watch": 0, "question": 0, "flag": 1}
}
